{
  "format": "HAHAWEEK-EVIDENCE-V4-GOLDEN-VECTORS-1",
  "protocol": "HAHAWEEK-EVIDENCE-V4",
  "canonicalization": "RFC8785-JCS-UTF8-SHA256-DOMAIN-SEPARATOR",
  "vectors": [
    {
      "vector_id": "transition-first-canonical-001",
      "domain": "HAHAWEEK-EVIDENCE-V4-TRANSITION",
      "input_object": {
        "evidence_id": "0xaaaaaaaaaaaaaaaaaaaaaaaaaaaaaaaaaaaaaaaaaaaaaaaaaaaaaaaaaaaaaaaa",
        "from_state": "OBSERVED",
        "previous_transition_hash": null,
        "sequence": "0",
        "to_state": "CANONICAL"
      },
      "canonical_utf8_hex": "7b2265766964656e63655f6964223a22307861616161616161616161616161616161616161616161616161616161616161616161616161616161616161616161616161616161616161616161616161616161222c2266726f6d5f7374617465223a224f42534552564544222c2270726576696f75735f7472616e736974696f6e5f68617368223a6e756c6c2c2273657175656e6365223a2230222c22746f5f7374617465223a2243414e4f4e4943414c227d",
      "expected_hash": "0x71ffe5282d44440cf5f9fc8635706c0e6cd3347bd7d86696916bb2fabbbc7c5c"
    },
    {
      "vector_id": "transition-subsequent-orphaned-002",
      "domain": "HAHAWEEK-EVIDENCE-V4-TRANSITION",
      "input_object": {
        "evidence_id": "0xaaaaaaaaaaaaaaaaaaaaaaaaaaaaaaaaaaaaaaaaaaaaaaaaaaaaaaaaaaaaaaaa",
        "from_state": "CANONICAL",
        "previous_transition_hash": "0x71ffe5282d44440cf5f9fc8635706c0e6cd3347bd7d86696916bb2fabbbc7c5c",
        "sequence": "1",
        "to_state": "ORPHANED"
      },
      "canonical_utf8_hex": "7b2265766964656e63655f6964223a22307861616161616161616161616161616161616161616161616161616161616161616161616161616161616161616161616161616161616161616161616161616161222c2266726f6d5f7374617465223a2243414e4f4e4943414c222c2270726576696f75735f7472616e736974696f6e5f68617368223a22307837316666653532383264343434343063663566396663383633353730366330653663643333343762643764383636393639313662623266616262626337633563222c2273657175656e6365223a2231222c22746f5f7374617465223a224f525048414e4544227d",
      "expected_hash": "0x58fad860a8f907a2782482e1af015034c9f6f9190eca959ab3a8419e67a1210c"
    },
    {
      "vector_id": "transition-max-uint64-003",
      "domain": "HAHAWEEK-EVIDENCE-V4-TRANSITION",
      "input_object": {
        "evidence_id": "0xaaaaaaaaaaaaaaaaaaaaaaaaaaaaaaaaaaaaaaaaaaaaaaaaaaaaaaaaaaaaaaaa",
        "from_state": "OBSERVED",
        "previous_transition_hash": null,
        "sequence": "18446744073709551615",
        "to_state": "CANONICAL"
      },
      "canonical_utf8_hex": "7b2265766964656e63655f6964223a22307861616161616161616161616161616161616161616161616161616161616161616161616161616161616161616161616161616161616161616161616161616161222c2266726f6d5f7374617465223a224f42534552564544222c2270726576696f75735f7472616e736974696f6e5f68617368223a6e756c6c2c2273657175656e6365223a223138343436373434303733373039353531363135222c22746f5f7374617465223a2243414e4f4e4943414c227d",
      "expected_hash": "0xe829f98c746203798253a43dcd2327bc8b51ea5bdc36445d529d4024eacfc1da"
    }
  ]
}
