{
  "format": "HAHAWEEK-EVIDENCE-V4-GOLDEN-VECTORS-1",
  "protocol": "HAHAWEEK-EVIDENCE-V4",
  "canonicalization": "RFC8785-JCS-UTF8-SHA256-DOMAIN-SEPARATOR",
  "vectors": [
    {
      "vector_id": "payload-event-identity-001",
      "domain": "HAHAWEEK-EVIDENCE-V4-PAYLOAD",
      "input_object": {
        "topic0": "0xaaaaaaaaaaaaaaaaaaaaaaaaaaaaaaaaaaaaaaaaaaaaaaaaaaaaaaaaaaaaaaaa",
        "log_index": "7",
        "chain_id": "1",
        "block_hash": "0xbbbbbbbbbbbbbbbbbbbbbbbbbbbbbbbbbbbbbbbbbbbbbbbbbbbbbbbbbbbbbbbb",
        "transaction_hash": "0xcccccccccccccccccccccccccccccccccccccccccccccccccccccccccccccccc",
        "block_number": "123",
        "contract_address": "0x1111111111111111111111111111111111111111",
        "transaction_index": "2"
      },
      "canonical_utf8_hex": "7b22626c6f636b5f68617368223a22307862626262626262626262626262626262626262626262626262626262626262626262626262626262626262626262626262626262626262626262626262626262222c22626c6f636b5f6e756d626572223a22313233222c22636861696e5f6964223a2231222c22636f6e74726163745f61646472657373223a22307831313131313131313131313131313131313131313131313131313131313131313131313131313131222c226c6f675f696e646578223a2237222c22746f70696330223a22307861616161616161616161616161616161616161616161616161616161616161616161616161616161616161616161616161616161616161616161616161616161222c227472616e73616374696f66e5f68617368223a22307863636363636363636363636363636363636363636363636363636363636363636363636363636363636363636363636363636363636363636363636363636363636363636363222c227472616e73616374696f6e5f696e646578223a2232227d",
      "expected_hash": "47f56cc45d527fea32daaee9b7c2019596fc988e29e27f8317fadfcb9865d185"
    },
    {
      "vector_id": "payload-event-identity-002",
      "domain": "HAHAWEEK-EVIDENCE-V4-PAYLOAD",
      "input_object": {
        "chain_id": "1",
        "block_hash": "0x0000000000000000000000000000000000000000000000000000000000000000",
        "block_number": "0",
        "transaction_hash": "0x0000000000000000000000000000000000000000000000000000000000000000",
        "transaction_index": "0",
        "log_index": "0",
        "contract_address": "0x0000000000000000000000000000000000000000",
        "topic0": "0x0000000000000000000000000000000000000000000000000000000000000000"
      },
      "canonical_utf8_hex": "7b22626c6f636b5f68617368223a22307830303030303030303030303030303030303030303030303030303030303030303030303030303030303030303030303030303030303030303030303030303030222c22626c6f636b5f6e756d626572223a2230222c22636861696e5f6964223a2231222c22636f6e74726163745f61646472657373223a22307830303030303030303030303030303030303030303030303030303030303030303030303030303030222c226c6f675f696e646578223a2230222c22746f70696330223a22307830303030303030303030303030303030303030303030303030303030303030303030303030303030303030303030303030303030303030303030303030303030303030222c227472616e73616374696f6e5f68617368223a22307830303030303030303030303030303030303030303030303030303030303030303030303030303030303030303030303030303030303030303030303030303030303030222c227472616e73616374696f6e5f696e646578223a2230227d",
      "expected_hash": "dc4b6801b58621501bc71ddd89507abe2d52224b868d12b8006009ba0b16b7a1"
    }
  ]
}
