{
  "format": "HAHAWEEK-EVIDENCE-V4-GOLDEN-VECTORS-1",
  "protocol": "HAHAWEEK-EVIDENCE-V4",
  "canonicalization": "RFC8785-JCS-UTF8-SHA256-DOMAIN-SEPARATOR",
  "vectors": [
    {
      "vector_id": "event-identity-canonical-001",
      "domain": "HAHAWEEK-EVIDENCE-V4-PAYLOAD",
      "input_object": {
        "chain_id": "4663",
        "block_hash": "0xaaaaaaaaaaaaaaaaaaaaaaaaaaaaaaaaaaaaaaaaaaaaaaaaaaaaaaaaaaaaaaaa",
        "block_number": "123",
        "transaction_hash": "0xbbbbbbbbbbbbbbbbbbbbbbbbbbbbbbbbbbbbbbbbbbbbbbbbbbbbbbbbbbbbbbbb",
        "transaction_index": "4",
        "log_index": "7",
        "contract_address": "0xcccccccccccccccccccccccccccccccccccccccc",
        "topic0": "0xdddddddddddddddddddddddddddddddddddddddddddddddddddddddddddddddd"
      },
      "canonical_utf8_hex": "7b22626c6f636b5f68617368223a22307861616161616161616161616161616161616161616161616161616161616161616161616161616161616161616161616161616161616161616161616161222c22626c6f636b5f6e756d626572223a22313233222c22636861696e5f6964223a2234363633222c22636f6e74726163745f61646472657373223a22307863636363636363636363636363636363636363636363636363636363636363636363636363636363222c226c6f675f696e646578223a2237222c22746f70696330223a22307864646464646464646464646464646464646464646464646464646464646464646464646464646464646464646464646464646464646464646464646464646464222c227472616e73616374696f6e5f68617368223a22307862626262626262626262626262626262626262626262626262626262626262626262626262626262626262626262626262626262626262626262626262626262222c227472616e73616374696f6e5f696e646578223a2234227d",
      "expected_hash": "8de0ef8960c3d4fe1e21b6409e78c9f54111bfa9a1c2d10c3b242451191e7674"
    }
  ]
}
